{"schemaVersion":1,"packageId":"fixture-map","revisionId":"fixture-map","entries":[{"role":"viewport-preview","path":"viewport-preview.txt","mediaType":"text/plain","sha256":"94dd1bfe86084a80c5cc1c5c91ef4a037aa5898e8e677039bff50a156f9e65a5"},{"role":"visual-diff","path":"visual-diff.txt","mediaType":"text/plain","sha256":"5c5caff47520b3ef6e760e032b365866b6e8ab4e4e759c53890a15e87d2fd240"},{"role":"asset-size-report","path":"asset-size-report.txt","mediaType":"text/plain","sha256":"dc312b8ef7e65ce49d91b306f13865e3ce34aab08b7e32f97ff4b099181fbd31"},{"role":"protected-element-report","path":"protected-element-report.txt","mediaType":"text/plain","sha256":"c795dcf5ccc7bb34507fc010b2966d1771b56785c427d0ac7323c6fa1638c4a4"},{"role":"accessibility-motion-report","path":"accessibility-motion-report.txt","mediaType":"text/plain","sha256":"c9e7299088b5bf88b0c689e384eb1fa4107e2d66afe57ae009569e96038ac108"},{"role":"performance-report","path":"performance-report.txt","mediaType":"text/plain","sha256":"093a2c76228c63768175b59759681f179577913398950b896e05737358529e73"},{"role":"deviation-list","path":"deviation-list.txt","mediaType":"text/plain","sha256":"d12fdd339f493a54642d639b8675abebf3241c2abbadde01a6de5641693d0f6a"}]}
